{
  "$schema": "http://json-schema.org/draft-07/schema#",
  "$id": "https://github.com/Two-Weeks-Team/PreviewForgeForClaudeCode/schemas/spec-anchor-audit.schema.json",
  "title": "SpecAnchorAudit",
  "description": "(v1.7.0+ C-5 / issue #62) Runtime evidence artifact for the v1.6 'advocates CONVERGE on idea.spec.json' marketing claim. Generated post Diversity-Validator by `scripts/generate-spec-anchor-audit.py` from the 26 advocate output cards + the I1 idea.spec.json. Persisted at `runs/<id>/spec-anchor-audit.json`. The audit makes convergence empirically measurable: framework_jaccard for primary surface stack, persona_distinct_count, surface_distinct_count, and the list of diverged advocates that breached the framework_convergence_threshold (default 3).",
  "type": "object",
  "required": [
    "run_id",
    "spec_filled_ratio",
    "advocate_alignments",
    "convergence_metrics"
  ],
  "properties": {
    "run_id": {
      "type": "string",
      "minLength": 1,
      "description": "Identifier of the run this audit covers (matches runs/<run_id>/)."
    },
    "spec_filled_ratio": {
      "type": "number",
      "minimum": 0,
      "maximum": 1,
      "description": "Mirror of idea.spec.json `_filled_ratio` at audit time. <0.2 triggers `low_confidence: true`."
    },
    "low_confidence": {
      "type": "boolean",
      "description": "Convenience flag set when spec_filled_ratio < 0.2. Downstream gates (M3 Gate H1) MAY surface this as a 'spec consistency' caveat in the modal."
    },
    "advocate_alignments": {
      "type": "array",
      "minItems": 1,
      "description": "Per-advocate alignment record extracted from preview-card output.",
      "items": {
        "type": "object",
        "required": [
          "advocate_id",
          "spec_field_interpretations",
          "framework_choice",
          "matches_spec_persona",
          "matches_spec_surface"
        ],
        "properties": {
          "advocate_id": {
            "type": "string",
            "pattern": "^P[0-9]{2}$"
          },
          "spec_field_interpretations": {
            "type": "string",
            "description": "Verbatim copy of the advocate's `spec_alignment_notes`."
          },
          "framework_choice": {
            "type": ["string", "null"],
            "description": "Framework token extracted via the canonical regex (see scripts/_advocate_parsing.py FRAMEWORK_TOKENS). null when no token matched."
          },
          "matches_spec_persona": {
            "type": "boolean",
            "description": "Whether advocate.target_persona substring-matches idea.spec.json target_persona.profile (case-insensitive). False if spec persona is null/unknown."
          },
          "matches_spec_surface": {
            "type": "boolean",
            "description": "Whether advocate.primary_surface aligns with idea.spec.json primary_surface.platform via the canonical surface→platform map. False if spec platform is null/unknown."
          }
        },
        "additionalProperties": false
      }
    },
    "convergence_metrics": {
      "type": "object",
      "required": [
        "framework_jaccard",
        "persona_distinct_count",
        "surface_distinct_count",
        "diverged_advocates"
      ],
      "properties": {
        "framework_jaccard": {
          "type": "number",
          "minimum": 0,
          "maximum": 1,
          "description": "Convergence score for framework_choice. Defined as max-bucket-share: (count of most-popular framework) / (count of advocates with non-null framework). 1.0 means total convergence, 1/N is full divergence. Advocates with null framework are excluded from the denominator."
        },
        "persona_distinct_count": {
          "type": "integer",
          "minimum": 0,
          "description": "Distinct target_persona strings across all 26 advocate cards (case-insensitive, trimmed)."
        },
        "surface_distinct_count": {
          "type": "integer",
          "minimum": 0,
          "description": "Distinct primary_surface enum values across all 26 advocate cards."
        },
        "diverged_advocates": {
          "type": "array",
          "description": "Advocate ids whose framework_choice falls outside the top (convergence_threshold) buckets. Empty when distinct_framework_count <= convergence_threshold.",
          "items": {
            "type": "string",
            "pattern": "^P[0-9]{2}$"
          }
        },
        "convergence_threshold": {
          "type": "integer",
          "minimum": 1,
          "description": "Maximum allowed distinct framework count before advocates beyond the top buckets are flagged. Defaults to 3."
        }
      },
      "additionalProperties": false
    },
    "_schema_version": {
      "type": "string",
      "pattern": "^[0-9]+\\.[0-9]+\\.[0-9]+$"
    }
  },
  "additionalProperties": false
}
